state_code,violation_code,vehicle_class,base_fine,repeat_fine,section,description,note
DL,194E,,10000,,Section 194E,Driving without valid insurance coverage.,Verified against the current Delhi Traffic Police offence schedule.; Delhi Traffic Police published penalty schedule; effective 2019-09-01; verified 2026-04-14; source https://traffic.delhipolice.gov.in/traffic-offences
GJ,183,,1000,,Section 183,Speeding beyond the notified limit.,Hackathon baseline only; official Gujarat source link still pending.; Transport Department Gujarat baseline schedule; effective 2019-09-01
KA,194D,,500,,Sections 129/194D,Failure to wear a helmet or seat belt as required.,Verified against the Bengaluru Traffic Police public FAQ page.; Bengaluru Traffic Police published FAQ schedule; effective 2019-09-01; verified 2026-04-14; source https://btp.gov.in/FAQs.aspx
KL,194D,,1000,,Sections 129/194D,Failure to wear a helmet or seat belt as required.,Kerala MVD public portal is the current reference point; confirm the exact gazette or circular before production use.; Motor Vehicles Department Kerala baseline schedule; effective 2019-09-01; verified 2026-04-14; source https://mvd.kerala.gov.in/en/faqs?page=1&tid=All&tid_1=All
MH,181,,500,,Sections 3/181,Driving without a valid driving licence.,Public state page is older than the 2019 central amendment; recheck against the current Maharashtra gazette before production.; Transport Department Maharashtra public compounding schedule; effective 2019-09-01; verified 2026-04-14; source https://transport.maharashtra.gov.in/1112/Offences-and-Penalties
TN,194D,,1000,,Sections 129/194D,Failure to wear a helmet or seat belt as required.,Hackathon baseline only; official gazette link still pending.; Transport and Road Safety Wing Tamil Nadu; effective 2019-09-01
